{
  "task": "qa",
  "dataset": "jsonl",
  "size": 2,
  "metrics": {
    "exact_match": {
      "accuracy": 0.0
    },
    "token_f1": {
      "f1": 0.0
    }
  },
  "adapter": "echo",
  "seed": 0,
  "timing": {
    "avg_latency_ms": 0.0013750104699283838,
    "total_seconds": 8.832954335957766e-06,
    "throughput_eps": 226424.8091783142,
    "request_successes": 2,
    "request_errors": 0,
    "error_rate": 0.0
  },
  "manifest": {
    "timestamp": "2025-08-09T00:03:31",
    "openeval_version": "0.0.1",
    "python": {
      "version": "3.12.7",
      "executable": "/Users/rsainju/Research/1_Research_Personal/untitled folder/.venv/bin/python3"
    },
    "platform": {
      "system": "Darwin",
      "release": "24.6.0",
      "machine": "arm64"
    },
    "packages": {
      "fastapi": "0.116.1",
      "jinja2": "3.1.6",
      "numpy": "2.3.2",
      "pandas": "2.3.1"
    },
    "adapter": {
      "name": "echo",
      "class": "openeval.adapters.echo.EchoAdapter"
    },
    "task": {
      "name": "qa",
      "class": "openeval.tasks.qa.QATask"
    }
  },
  "dataset_path": "examples/qa_toy.jsonl",
  "dataset_hash_sha256": "9c52486013430898a086358be77233b1d6d990c776d7bd9ce9f9c5eedbf72540",
  "records": [
    {
      "id": "1",
      "input": "What is 2+2?",
      "reference": "4",
      "prediction": "Answer the question succinctly.",
      "latency_ms": 0.0018749851733446121
    },
    {
      "id": "2",
      "input": "Capital of France?",
      "reference": "Paris",
      "prediction": "Answer the question succinctly.",
      "latency_ms": 0.0008750357665121555
    }
  ],
  "spec_path": "examples/qa_spec.json",
  "spec_hash_sha256": "49167de7db32d8e11b859c9e3e90ce1b29c40b9629b7ee1d766771bfa4cdb507"
}
